85123A,WHITE HANGING HEART T-LIGHT HOLDER,6,2.55
71053,WHITE METAL LANTERN,6,3.39
84406B,CREAM CUPID HEARTS COAT HANGER,8,2.75
84029G,KNITTED UNION FLAG HOT WATER BOTTLE,6,3.39
84029E,RED WOOLLY HOTTIE WHITE HEART.,6,3.39
22752,SET 7 BABUSHKA NESTING BOXES,2,7.65
21730,GLASS STAR FROSTED T-LIGHT HOLDER,6,4.25
22633,HAND WARMER UNION JACK,6,1.85
22632,HAND WARMER RED POLKA DOT,6,1.85
84879,ASSORTED COLOUR BIRD ORNAMENT,32,1.69
22745,POPPY'S PLAYHOUSE BEDROOM ,6,2.1
22748,POPPY'S PLAYHOUSE KITCHEN,6,2.1
22749,FELTCRAFT PRINCESS CHARLOTTE DOLL,8,3.75
22310,IVORY KNITTED MUG COSY ,6,1.65
84969,BOX OF 6 ASSORTED COLOUR TEASPOONS,6,4.25
22623,BOX OF VINTAGE JIGSAW BLOCKS ,3,4.95
22622,BOX OF VINTAGE ALPHABET BLOCKS,2,9.95
21754,HOME BUILDING BLOCK WORD,3,5.95
21755,LOVE BUILDING BLOCK WORD,3,5.95
21777,RECIPE BOX WITH METAL HEART,4,7.95
48187,DOORMAT NEW ENGLAND,4,7.95
22960,JAM MAKING SET WITH JARS,6,4.25
22913,RED COAT RACK PARIS FASHION,3,4.95
22912,YELLOW COAT RACK PARIS FASHION,3,4.95
22914,BLUE COAT RACK PARIS FASHION,3,4.95
21756,BATH BUILDING BLOCK WORD,3,5.95
22728,ALARM CLOCK BAKELIKE PINK,24,3.75
22727,ALARM CLOCK BAKELIKE RED ,24,3.75
22726,ALARM CLOCK BAKELIKE GREEN,12,3.75
21724,PANDA AND BUNNIES STICKER SHEET,12,0.85
21883,STARS GIFT TAPE ,24,0.65
10002,INFLATABLE POLITICAL GLOBE ,48,0.85
21791,VINTAGE HEADS AND TAILS CARD GAME ,24,1.25
21035,SET/2 RED RETROSPOT TEA TOWELS ,18,2.95
22326,ROUND SNACK BOXES SET OF4 WOODLAND ,24,2.95
22629,SPACEBOY LUNCH BOX ,24,1.95
22659,LUNCH BOX I LOVE LONDON,24,1.95
22631,CIRCUS PARADE LUNCH BOX ,24,1.95
22661,CHARLOTTE BAG DOLLY GIRL DESIGN,20,0.85
21731,RED TOADSTOOL LED NIGHT LIGHT,24,1.65
22900, SET 2 TEA TOWELS I LOVE LONDON ,24,2.95
21913,VINTAGE SEASIDE JIGSAW PUZZLES,12,3.75
22540,MINI JIGSAW CIRCUS PARADE ,24,0.42
22544,MINI JIGSAW SPACEBOY,24,0.42
22492,MINI PAINT SET VINTAGE ,36,0.65
POST,POSTAGE,3,18
22086,PAPER CHAIN KIT 50'S CHRISTMAS ,80,2.55
22632,HAND WARMER RED POLKA DOT,6,1.85
22633,HAND WARMER UNION JACK,6,1.85
85123A,WHITE HANGING HEART T-LIGHT HOLDER,6,2.55
71053,WHITE METAL LANTERN,6,3.39
84406B,CREAM CUPID HEARTS COAT HANGER,8,2.75
20679,EDWARDIAN PARASOL RED,6,4.95
37370,RETRO COFFEE MUGS ASSORTED,6,1.06
21871,SAVE THE PLANET MUG,6,1.06
21071,VINTAGE BILLBOARD DRINK ME MUG,6,1.06
21068,VINTAGE BILLBOARD LOVE/HATE MUG,6,1.06
82483,WOOD 2 DRAWER CABINET WHITE FINISH,2,4.95
82486,WOOD S/3 CABINET ANT WHITE FINISH,4,6.95
82482,WOODEN PICTURE FRAME WHITE FINISH,6,2.1
82494L,WOODEN FRAME ANTIQUE WHITE ,6,2.55
84029G,KNITTED UNION FLAG HOT WATER BOTTLE,6,3.39
84029E,RED WOOLLY HOTTIE WHITE HEART.,6,3.39
22752,SET 7 BABUSHKA NESTING BOXES,2,7.65
21730,GLASS STAR FROSTED T-LIGHT HOLDER,6,4.25
21258,VICTORIAN SEWING BOX LARGE,32,10.95
85123A,WHITE HANGING HEART T-LIGHT HOLDER,6,2.55
71053,WHITE METAL LANTERN,6,3.39
84406B,CREAM CUPID HEARTS COAT HANGER,8,2.75
20679,EDWARDIAN PARASOL RED,6,4.95
37370,RETRO COFFEE MUGS ASSORTED,6,1.06
21871,SAVE THE PLANET MUG,6,1.06
21071,VINTAGE BILLBOARD DRINK ME MUG,6,1.06
21068,VINTAGE BILLBOARD LOVE/HATE MUG,6,1.06
82483,WOOD 2 DRAWER CABINET WHITE FINISH,2,4.95
82486,WOOD S/3 CABINET ANT WHITE FINISH,4,6.95
82482,WOODEN PICTURE FRAME WHITE FINISH,6,2.1
82494L,WOODEN FRAME ANTIQUE WHITE ,6,2.55
84029G,KNITTED UNION FLAG HOT WATER BOTTLE,6,3.39
84029E,RED WOOLLY HOTTIE WHITE HEART.,6,3.39